Sheet: 27.12.19
A1: Наименование | B1: Утренний заказ | C1: Продажи Деливери | D1: Продажи Яндекс/Рарус Яндекс | E1: Комплименты, порча | F1: Питание | G1: Отсюда в Дозаказ | H1: Дозаказ | I1: Списание Деливери | J1: Возврат на кухню Деливери | K1: Итоговое значение для Раруса Деливери
A2: Аджика 30г | B2: 1 | G2: of:=IF(([.I2]<=0);-[.I2];0) -> 0 | H2: 0 | I2: of:=[.B2]+[.H2]-[.C2]-[.E2]-[.D2]-[.F2] -> 1 | K2: of:=[.B2]+[.H2]-[.J2]-[.D2] -> 1
A3: Айран 0,250 | B3: 1 | G3: of:=IF(([.I3]<=0);-[.I3];0) -> -0 | H3: 0 | J3: of:=[.B3]+[.H3]-[.C3]-[.E3]-[.D3] -> 1 | K3: of:=[.B3]+[.H3]-[.J3]-[.D3] -> 0
A4: Бефстроганов с телятиной | B4: 1 | C4: 4 | D4: 3 | G4: of:=IF(([.I4]<=0);-[.I4];0) -> -0 | H4: 6 | I4: of:=[.B4]+[.H4]-[.C4]-[.E4]-[.D4]-[.F4] -> 0 | K4: of:=[.B4]+[.H4]-[.J4]-[.D4] -> 4
A5: Борщ | B5: 1 | C5: 0 | D5: 1 | G5: of:=IF(([.I5]<=0);-[.I5];0) -> -0 | H5: 0 | I5: of:=[.B5]+[.H5]-[.C5]-[.E5]-[.D5]-[.F5] -> 0 | K5: of:=[.B5]+[.H5]-[.J5]-[.D5] -> 0
A6: Волшебные шарики в вафельной крошкой | B6: 1 | E6: 1 | G6: of:=IF(([.I6]<=0);-[.I6];0) -> -0 | H6: 0 | J6: of:=[.B6]+[.H6]-[.C6]-[.E6]-[.D6] -> 0 | K6: of:=[.B6]+[.H6]-[.J6]-[.D6] -> 1
A7: Волшебные шарики в кокосовой стружкой | B7: 1 | E7: 1 | G7: of:=IF(([.I7]<=0);-[.I7];0) -> -0 | H7: 0 | J7: of:=[.B7]+[.H7]-[.C7]-[.E7]-[.D7] -> 0 | K7: of:=[.B7]+[.H7]-[.J7]-[.D7] -> 1
A8: Гречка с Морковью | B8: 1 | G8: of:=IF(([.I8]<=0);-[.I8];0) -> 0 | H8: 0 | I8: of:=[.B8]+[.H8]-[.C8]-[.E8]-[.D8]-[.F8] -> 1 | K8: of:=[.B8]+[.H8]-[.J8]-[.D8] -> 1
A9: Десерт Павлова | G9: of:=IF(([.I9]<=0);-[.I9];0) -> -0 | H9: 0 | I9: of:=[.B9]+[.H9]-[.C9]-[.E9]-[.D9]-[.F9] -> 0 | K9: of:=[.B9]+[.H9]-[.J9]-[.D9] -> 0
A10: Десерт тирамису | B10: 1 | E10: 1 | G10: of:=IF(([.I10]<=0);-[.I10];0) -> -0 | H10: 0 | J10: of:=[.B10]+[.H10]-[.C10]-[.E10]-[.D10] -> 0 | K10: of:=[.B10]+[.H10]-[.J10]-[.D10] -> 1
A11: Домашний пирог с картофелем и сыром | C11: 1 | G11: of:=IF(([.I11]<=0);-[.I11];0) -> -0 | H11: 1 | I11: of:=[.B11]+[.H11]-[.C11]-[.E11]-[.D11]-[.F11] -> 0 | K11: of:=[.B11]+[.H11]-[.J11]-[.D11] -> 1
A12: Картофель жареный с грибами | B12: 1 | G12: of:=IF(([.I12]<=0);-[.I12];0) -> 0 | H12: 0 | I12: of:=[.B12]+[.H12]-[.C12]-[.E12]-[.D12]-[.F12] -> 1 | K12: of:=[.B12]+[.H12]-[.J12]-[.D12] -> 1
A13: Картофель черри с чесноком | B13: 1 | G13: of:=IF(([.I13]<=0);-[.I13];0) -> 0 | H13: 0 | I13: of:=[.B13]+[.H13]-[.C13]-[.E13]-[.D13]-[.F13] -> 1 | K13: of:=[.B13]+[.H13]-[.J13]-[.D13] -> 1
A14: Каурма Лагман | B14: 1 | G14: of:=IF(([.I14]<=0);-[.I14];0) -> 0 | H14: 0 | I14: of:=[.B14]+[.H14]-[.C14]-[.E14]-[.D14]-[.F14] -> 1 | K14: of:=[.B14]+[.H14]-[.J14]-[.D14] -> 1
A15: Кок Шурпа | B15: 1 | C15: 2 | G15: of:=IF(([.I15]<=0);-[.I15];0) -> -0 | H15: 1 | I15: of:=[.B15]+[.H15]-[.C15]-[.E15]-[.D15]-[.F15] -> 0 | K15: of:=[.B15]+[.H15]-[.J15]-[.D15] -> 2
A16: Компот из сухофруктов 0,5 | G16: of:=IF(([.I16]<=0);-[.I16];0) -> -0 | H16: 0 | J16: of:=[.B16]+[.H16]-[.C16]-[.E16]-[.D16] -> 0 | K16: of:=[.B16]+[.H16]-[.J16]-[.D16] -> 0
A17: Кук Си | G17: of:=IF(([.I17]<=0);-[.I17];0) -> -0 | H17: 0 | I17: of:=[.B17]+[.H17]-[.C17]-[.E17]-[.D17]-[.F17] -> 0 | J17: of:=[.B17]+[.H17]-[.C17]-[.E17]-[.D17] -> 0 | K17: of:=[.B17]+[.H17]-[.J17]-[.D17] -> 0
A18: Куриная грудка на гриле | B18: 2 | C18: 1 | G18: of:=IF(([.I18]<=0);-[.I18];0) -> 0 | H18: 0 | I18: of:=[.B18]+[.H18]-[.C18]-[.E18]-[.D18]-[.F18] -> 1 | K18: of:=[.B18]+[.H18]-[.J18]-[.D18] -> 2
A19: Ланч №1 | B19: 7 | C19: 1 | F19: 6 | G19: of:=IF(([.I19]<=0);-[.I19];0) -> -0 | H19: 0 | I19: of:=[.B19]+[.H19]-[.C19]-[.E19]-[.D19]-[.F19] -> 0 | K19: of:=[.B19]+[.H19]-[.J19]-[.D19] -> 7
A20: Ланч №2 | B20: 7 | C20: 5 | D20: 1 | F20: 1 | G20: of:=IF(([.I20]<=0);-[.I20];0) -> -0 | H20: 0 | I20: of:=[.B20]+[.H20]-[.C20]-[.E20]-[.D20]-[.F20] -> 0 | K20: of:=[.B20]+[.H20]-[.J20]-[.D20] -> 6
A21: Ланч №3 | B21: 7 | C21: 7 | G21: of:=IF(([.I21]<=0);-[.I21];0) -> -0 | H21: 0 | I21: of:=[.B21]+[.H21]-[.C21]-[.E21]-[.D21]-[.F21] -> 0 | K21: of:=[.B21]+[.H21]-[.J21]-[.D21] -> 7
A22: Ланч №4 | B22: 2 | G22: of:=IF(([.I22]<=0);-[.I22];0) -> 0 | H22: 0 | I22: of:=[.B22]+[.H22]-[.C22]-[.E22]-[.D22]-[.F22] -> 2 | K22: of:=[.B22]+[.H22]-[.J22]-[.D22] -> 2
A23: Ланч №5 | B23: 2 | C23: 1 | G23: of:=IF(([.I23]<=0);-[.I23];0) -> 0 | H23: 0 | I23: of:=[.B23]+[.H23]-[.C23]-[.E23]-[.D23]-[.F23] -> 1 | K23: of:=[.B23]+[.H23]-[.J23]-[.D23] -> 2
A24: Лимонно-маноговый чизкейк | B24: 1 | G24: of:=IF(([.I24]<=0);-[.I24];0) -> -0 | H24: 0 | J24: of:=[.B24]+[.H24]-[.C24]-[.E24]-[.D24] -> 1 | K24: of:=[.B24]+[.H24]-[.J24]-[.D24] -> 0
A25: Люля кебаб из баранины | B25: 2 | G25: of:=IF(([.I25]<=0);-[.I25];0) -> 0 | H25: 0 | I25: of:=[.B25]+[.H25]-[.C25]-[.E25]-[.D25]-[.F25] -> 2 | K25: of:=[.B25]+[.H25]-[.J25]-[.D25] -> 2
A26: Люля кебаб из телятины | B26: 2 | D26: 2 | G26: of:=IF(([.I26]<=0);-[.I26];0) -> -0 | H26: 0 | I26: of:=[.B26]+[.H26]-[.C26]-[.E26]-[.D26]-[.F26] -> 0 | K26: of:=[.B26]+[.H26]-[.J26]-[.D26] -> 0
A27: Манты с бараниной | B27: 1 | G27: of:=IF(([.I27]<=0);-[.I27];0) -> 0 | H27: 0 | I27: of:=[.B27]+[.H27]-[.C27]-[.E27]-[.D27]-[.F27] -> 1 | K27: of:=[.B27]+[.H27]-[.J27]-[.D27] -> 1
A28: Меренга с вишней | B28: 1 | E28: 1 | G28: of:=IF(([.I28]<=0);-[.I28];0) -> -0 | H28: 0 | J28: of:=[.B28]+[.H28]-[.C28]-[.E28]-[.D28] -> 0 | K28: of:=[.B28]+[.H28]-[.J28]-[.D28] -> 1
A29: Мисо суп | B29: 1 | G29: of:=IF(([.I29]<=0);-[.I29];0) -> 0 | H29: 0 | I29: of:=[.B29]+[.H29]-[.C29]-[.E29]-[.D29]-[.F29] -> 1 | K29: of:=[.B29]+[.H29]-[.J29]-[.D29] -> 1
A30: Морс брусничный 0,5 | G30: of:=IF(([.I30]<=0);-[.I30];0) -> -0 | H30: 0 | J30: of:=[.B30]+[.H30]-[.C30]-[.E30]-[.D30] -> 0 | K30: of:=[.B30]+[.H30]-[.J30]-[.D30] -> 0
A31: Морс вишневый 0,5 | G31: of:=IF(([.I31]<=0);-[.I31];0) -> -0 | H31: 0 | J31: of:=[.B31]+[.H31]-[.C31]-[.E31]-[.D31] -> 0 | K31: of:=[.B31]+[.H31]-[.J31]-[.D31] -> 0
A32: Морс клюквенный 0,5 | G32: of:=IF(([.I32]<=0);-[.I32];0) -> -0 | H32: 0 | J32: of:=[.B32]+[.H32]-[.C32]-[.E32]-[.D32] -> 0 | K32: of:=[.B32]+[.H32]-[.J32]-[.D32] -> 0
A33: Морс малиновый 0,5 | G33: of:=IF(([.I33]<=0);-[.I33];0) -> -0 | H33: 0 | J33: of:=[.B33]+[.H33]-[.C33]-[.E33]-[.D33] -> 0 | K33: of:=[.B33]+[.H33]-[.J33]-[.D33] -> 0
A34: Морс облепиха 0,5 | G34: of:=IF(([.I34]<=0);-[.I34];0) -> -0 | H34: 0 | J34: of:=[.B34]+[.H34]-[.C34]-[.E34]-[.D34] -> 0 | K34: of:=[.B34]+[.H34]-[.J34]-[.D34] -> 0
A35: Морс черная смородина 0,5 | G35: of:=IF(([.I35]<=0);-[.I35];0) -> -0 | H35: 0 | J35: of:=[.B35]+[.H35]-[.C35]-[.E35]-[.D35] -> 0 | K35: of:=[.B35]+[.H35]-[.J35]-[.D35] -> 0
A36: Окрошка на Квасе | G36: of:=IF(([.I36]<=0);-[.I36];0) -> -0 | H36: 0 | I36: of:=[.B36]+[.H36]-[.C36]-[.E36]-[.D36]-[.F36] -> 0 | J36: of:=[.B36]+[.H36]-[.C36]-[.E36]-[.D36] -> 0 | K36: of:=[.B36]+[.H36]-[.J36]-[.D36] -> 0
A37: Панна кота | B37: 1 | E37: 1 | G37: of:=IF(([.I37]<=0);-[.I37];0) -> -0 | H37: 0 | J37: of:=[.B37]+[.H37]-[.C37]-[.E37]-[.D37] -> 0 | K37: of:=[.B37]+[.H37]-[.J37]-[.D37] -> 1
A38: Пельмени | B38: 2 | C38: 2 | G38: of:=IF(([.I38]<=0);-[.I38];0) -> -0 | H38: 0 | I38: of:=[.B38]+[.H38]-[.C38]-[.E38]-[.D38]-[.F38] -> 0 | K38: of:=[.B38]+[.H38]-[.J38]-[.D38] -> 2
A39: Печенье с арахисом | B39: 1 | G39: of:=IF(([.I39]<=0);-[.I39];0) -> -0 | H39: 0 | J39: of:=[.B39]+[.H39]-[.C39]-[.E39]-[.D39] -> 1 | K39: of:=[.B39]+[.H39]-[.J39]-[.D39] -> 0
A40: Пирог бананово-тыквенный | B40: 1 | E40: 1 | G40: of:=IF(([.I40]<=0);-[.I40];0) -> -0 | H40: 0 | J40: of:=[.B40]+[.H40]-[.C40]-[.E40]-[.D40] -> 0 | K40: of:=[.B40]+[.H40]-[.J40]-[.D40] -> 1
A41: Пирог шарлотка | B41: 1 | C41: 2 | E41: 1 | G41: of:=IF(([.I41]<=0);-[.I41];0) -> -0 | H41: 2 | J41: of:=[.B41]+[.H41]-[.C41]-[.E41]-[.D41] -> 0 | K41: of:=[.B41]+[.H41]-[.J41]-[.D41] -> 3
A42: Плов Чайханский | B42: 1 | C42: 3 | D42: 1 | G42: of:=IF(([.I42]<=0);-[.I42];0) -> -0 | H42: 3 | I42: of:=[.B42]+[.H42]-[.C42]-[.E42]-[.D42]-[.F42] -> 0 | K42: of:=[.B42]+[.H42]-[.J42]-[.D42] -> 3
A43: Рис на Пару | B43: 1 | G43: of:=IF(([.I43]<=0);-[.I43];0) -> 0 | H43: 0 | I43: of:=[.B43]+[.H43]-[.C43]-[.E43]-[.D43]-[.F43] -> 1 | K43: of:=[.B43]+[.H43]-[.J43]-[.D43] -> 1
A44: Ролл Калифорния | G44: of:=IF(([.I44]<=0);-[.I44];0) -> -0 | H44: 0 | I44: of:=[.B44]+[.H44]-[.C44]-[.E44]-[.D44]-[.F44] -> 0 | K44: of:=[.B44]+[.H44]-[.J44]-[.D44] -> 0
A45: Ролл Филадельфия | B45: 1 | G45: of:=IF(([.I45]<=0);-[.I45];0) -> 0 | H45: 0 | I45: of:=[.B45]+[.H45]-[.C45]-[.E45]-[.D45]-[.F45] -> 1 | K45: of:=[.B45]+[.H45]-[.J45]-[.D45] -> 1
A46: Салат Греческий с сыром Фета | B46: 1 | C46: 2 | G46: of:=IF(([.I46]<=0);-[.I46];0) -> -0 | H46: 1 | I46: of:=[.B46]+[.H46]-[.C46]-[.E46]-[.D46]-[.F46] -> 0 | K46: of:=[.B46]+[.H46]-[.J46]-[.D46] -> 2
A47: Салат оливье с курицей | B47: 3 | C47: 1 | G47: of:=IF(([.I47]<=0);-[.I47];0) -> 0 | H47: 0 | I47: of:=[.B47]+[.H47]-[.C47]-[.E47]-[.D47]-[.F47] -> 2 | K47: of:=[.B47]+[.H47]-[.J47]-[.D47] -> 3
A48: Салат Цезарь с курицей | B48: 1 | C48: 3 | G48: of:=IF(([.I48]<=0);-[.I48];0) -> -0 | H48: 2 | I48: of:=[.B48]+[.H48]-[.C48]-[.E48]-[.D48]-[.F48] -> 0 | K48: of:=[.B48]+[.H48]-[.J48]-[.D48] -> 3
A49: Семга на Пару | B49: 1 | G49: of:=IF(([.I49]<=0);-[.I49];0) -> 0 | H49: 0 | I49: of:=[.B49]+[.H49]-[.C49]-[.E49]-[.D49]-[.F49] -> 1 | K49: of:=[.B49]+[.H49]-[.J49]-[.D49] -> 1
A50: Суп пюре Грибной | B50: 1 | C50: 2 | D50: 1 | G50: of:=IF(([.I50]<=0);-[.I50];0) -> -0 | H50: 2 | I50: of:=[.B50]+[.H50]-[.C50]-[.E50]-[.D50]-[.F50] -> 0 | K50: of:=[.B50]+[.H50]-[.J50]-[.D50] -> 2
A51: Тавук Шурпа | B51: 2 | C51: 3 | G51: of:=IF(([.I51]<=0);-[.I51];0) -> -0 | H51: 1 | I51: of:=[.B51]+[.H51]-[.C51]-[.E51]-[.D51]-[.F51] -> 0 | K51: of:=[.B51]+[.H51]-[.J51]-[.D51] -> 3
A52: Торт медовик | B52: 1 | G52: of:=IF(([.I52]<=0);-[.I52];0) -> -0 | H52: 0 | J52: of:=[.B52]+[.H52]-[.C52]-[.E52]-[.D52] -> 1 | K52: of:=[.B52]+[.H52]-[.J52]-[.D52] -> 0
A53: Торт наполеон | B53: 1 | G53: of:=IF(([.I53]<=0);-[.I53];0) -> -0 | H53: 0 | J53: of:=[.B53]+[.H53]-[.C53]-[.E53]-[.D53] -> 1 | K53: of:=[.B53]+[.H53]-[.J53]-[.D53] -> 0
A54: Торт прага | B54: 1 | D54: 1 | G54: of:=IF(([.I54]<=0);-[.I54];0) -> -0 | H54: 0 | J54: of:=[.B54]+[.H54]-[.C54]-[.E54]-[.D54] -> 0 | K54: of:=[.B54]+[.H54]-[.J54]-[.D54] -> 0
A55: Торт с черносливом и сгущенкой | B55: 1 | E55: 1 | G55: of:=IF(([.I55]<=0);-[.I55];0) -> -0 | H55: 0 | J55: of:=[.B55]+[.H55]-[.C55]-[.E55]-[.D55] -> 0 | K55: of:=[.B55]+[.H55]-[.J55]-[.D55] -> 1
A56: Торт шоколадный | B56: 1 | C56: 1 | G56: of:=IF(([.I56]<=0);-[.I56];0) -> -0 | H56: 0 | J56: of:=[.B56]+[.H56]-[.C56]-[.E56]-[.D56] -> 0 | K56: of:=[.B56]+[.H56]-[.J56]-[.D56] -> 1
A57: Хачапури по-мергельски | C57: 4 | G57: of:=IF(([.I57]<=0);-[.I57];0) -> -0 | H57: 4 | I57: of:=[.B57]+[.H57]-[.C57]-[.E57]-[.D57]-[.F57] -> 0 | K57: of:=[.B57]+[.H57]-[.J57]-[.D57] -> 4
A58: Черничный чизкейк | B58: 1 | G58: of:=IF(([.I58]<=0);-[.I58];0) -> -0 | H58: 0 | J58: of:=[.B58]+[.H58]-[.C58]-[.E58]-[.D58] -> 1 | K58: of:=[.B58]+[.H58]-[.J58]-[.D58] -> 0
A59: Шаурма с курицей | B59: 4 | C59: 5 | D59: 1 | G59: of:=IF(([.I59]<=0);-[.I59];0) -> -0 | H59: 2 | I59: of:=[.B59]+[.H59]-[.C59]-[.E59]-[.D59]-[.F59] -> 0 | K59: of:=[.B59]+[.H59]-[.J59]-[.D59] -> 5
A60: Шаш кебаб с курицей по кавказки | B60: 3 | C60: 4 | D60: 2 | G60: of:=IF(([.I60]<=0);-[.I60];0) -> -0 | H60: 3 | I60: of:=[.B60]+[.H60]-[.C60]-[.E60]-[.D60]-[.F60] -> 0 | K60: of:=[.B60]+[.H60]-[.J60]-[.D60] -> 4
A61: Шаш-кебаб с бараниной | B61: 2 | G61: of:=IF(([.I61]<=0);-[.I61];0) -> 0 | H61: 0 | I61: of:=[.B61]+[.H61]-[.C61]-[.E61]-[.D61]-[.F61] -> 2 | K61: of:=[.B61]+[.H61]-[.J61]-[.D61] -> 2
A62: Шаш кебаб с телятиной | B62: 2 | C62: 1 | G62: of:=IF(([.I62]<=0);-[.I62];0) -> 0 | H62: 0 | I62: of:=[.B62]+[.H62]-[.C62]-[.E62]-[.D62]-[.F62] -> 1 | K62: of:=[.B62]+[.H62]-[.J62]-[.D62] -> 2